{"format":"org.kinetik.bloom.dependencies.prefix","schemaVersion":{"major":1,"minor":0},"lockIdentity":"sha256:3a12df1cecff55b171ee3351dcad80fbb5cb52f44924c95ce5056535709d8d79","profile":{"id":"bloom.linux-release","target":{"triple":"x86_64-unknown-linux-gnu","operatingSystem":"linux","architecture":"x86_64","minimumOsVersion":null},"buildConfiguration":"release","consumerAbi":{"cxxStandard":20,"compilerFamily":"gcc","compilerAbi":"gcc.synthetic-abi","standardLibrary":"libstdc++","standardLibraryAbi":"libstdcxx.synthetic-abi","cxxRuntime":"libgcc","cxxRuntimeAbi":"libgcc.synthetic-abi","cxxRuntimeLinkage":"dynamic","platformRuntime":"glibc","platformRuntimeAbi":"glibc.synthetic-abi","exceptions":true,"rtti":true,"libstdcxxCxx11Abi":1,"msvcRuntime":null,"msvcIteratorDebugLevel":null,"windowsSdk":null,"windowsSdkVersion":null,"appleSdk":null,"appleSdkVersion":null,"appleDeploymentTarget":null,"abiFlags":[]},"toolchain":{"cmake":{"name":"cmake","version":"synthetic","identity":"synthetic-cmake"},"generator":{"name":"ninja","version":"synthetic","identity":"synthetic-generator"},"buildTool":{"name":"ninja","version":"synthetic","identity":"synthetic-build-tool"},"compiler":{"name":"gcc","version":"synthetic","identity":"synthetic-compiler"},"linker":{"name":"ld","version":"synthetic","identity":"synthetic-linker"},"standardLibrary":{"name":"libstdc++","version":"synthetic","identity":"synthetic-standard-library"},"sdk":{"name":"linux-sysroot","version":"synthetic","identity":"synthetic-sdk"}},"environment":{"profileId":"bloom.environment.synthetic","sourceDateEpoch":0,"variables":[]},"qualificationGates":[{"gateId":"bloom.gate.synthetic","disposition":"required","reason":null}]},"unicodeProfile":{"version":"15.1.0","sourceUrl":"https://example.invalid/ucd.zip","archiveSha256":"sha256:2a48c8a9d64298c36fea7ae32ee9e780df26de661030345775a4c74cc77be08b","files":[{"path":"UnicodeData.txt","sha256":"sha256:9d26bb74efc4972462e981ab4f476e7e4ebe931619743ba987767066593e1277"},{"path":"CompositionExclusions.txt","sha256":"sha256:be50f8ba7ce727cf22a1cdd5e53b106c3a96c34212511182fe05981ba2d68263"},{"path":"DerivedNormalizationProps.txt","sha256":"sha256:18689aeb9a46ce9f81561fd58d89b7c88bb6e15ec2cd126547793271f7249683"},{"path":"CaseFolding.txt","sha256":"sha256:a808ddb349f098b1df9e12b5fa34b49f11627a1c860390028445f534b2212b13"},{"path":"NormalizationTest.txt","sha256":"sha256:0ac6226cca9afa0f6981e0435e8c5f0cd1dd9c1a5f67ccb7c094e4260c26d5f5"}]},"components":[{"name":"component.alpha","version":"synthetic-1.0","sourceArchiveSha256":"sha256:4abd61c06dfdbe9fb8e5fb5b2874ba6bb08016fdec02a7c4ee59f870d6d8a45f","sourceCommit":null,"patches":[],"buildOptionsIdentity":"sha256:5a014d1740b6ca8189d1195c2f670d22ac6e94367f33d18808fa84094f4c424b"},{"name":"component.beta","version":"synthetic-1.0","sourceArchiveSha256":"sha256:4abd61c06dfdbe9fb8e5fb5b2874ba6bb08016fdec02a7c4ee59f870d6d8a45f","sourceCommit":null,"patches":[],"buildOptionsIdentity":"sha256:5bc93726991d01181405854fcd7f261ca5b2807cdd09a1b5beb6973985f5b4e5"}],"capabilities":[{"id":"bloom.capability.alpha","providerComponent":"component.alpha"},{"id":"bloom.capability.beta","providerComponent":"component.beta"}],"cmakePackages":[],"installedFiles":[{"path":"share/bloom/dependencies/evidence/tests/fixtures/payloads/alpha-license-review.txt","type":"regular-file","component":"component.alpha","role":"qualification-evidence","size":59,"sha256":"sha256:18a62e4bbb0ac1152c952627e91da870625e822fc64d8ac6c58fb2757350981a","permissions":"regular","linkTarget":null},{"path":"share/bloom/dependencies/evidence/tests/fixtures/payloads/alpha-license.txt","type":"regular-file","component":"component.alpha","role":"license","size":52,"sha256":"sha256:4e11c75cff9d6108763f0807e0c6881cc511b76ab820ef0ace57523d1cf1cd17","permissions":"regular","linkTarget":null},{"path":"share/bloom/dependencies/evidence/tests/fixtures/payloads/alpha-provenance-review.txt","type":"regular-file","component":"component.alpha","role":"qualification-evidence","size":62,"sha256":"sha256:5a1417f3963f05c98d040b32ae9d91a16db46a1ff89ef017b595b6f1c0409e9b","permissions":"regular","linkTarget":null},{"path":"share/bloom/dependencies/evidence/tests/fixtures/payloads/alpha-security-review.txt","type":"regular-file","component":"component.alpha","role":"qualification-evidence","size":60,"sha256":"sha256:756455bce69ac5eceda6752df536d19d64f0399c18a32e03b7eeba1686a5338f","permissions":"regular","linkTarget":null},{"path":"share/bloom/dependencies/evidence/tests/fixtures/payloads/beta-license-review.txt","type":"regular-file","component":"component.beta","role":"qualification-evidence","size":58,"sha256":"sha256:a0cc1f7f57cf77e5781d17f81a111032cc1032622aba9e4b4e6280988df48ca8","permissions":"regular","linkTarget":null},{"path":"share/bloom/dependencies/evidence/tests/fixtures/payloads/beta-license.txt","type":"regular-file","component":"component.beta","role":"license","size":51,"sha256":"sha256:75156212dead91aec4b1e7f5aa4b0eb53a6d44a88b8141eb41530a9611b0feee","permissions":"regular","linkTarget":null},{"path":"share/bloom/dependencies/evidence/tests/fixtures/payloads/beta-provenance-review.txt","type":"regular-file","component":"component.beta","role":"qualification-evidence","size":61,"sha256":"sha256:17c089161f7d2db0c6be072a9f6a80c3787373802530f50046ea6612df767c16","permissions":"regular","linkTarget":null},{"path":"share/bloom/dependencies/evidence/tests/fixtures/payloads/beta-security-review.txt","type":"regular-file","component":"component.beta","role":"qualification-evidence","size":59,"sha256":"sha256:fba88080f42025ecb20802f8c73e3034deeeb51403a1404d6d03a2ce26ab8ac4","permissions":"regular","linkTarget":null},{"path":"share/bloom/dependencies/evidence/tests/fixtures/payloads/gate-evidence.txt","type":"regular-file","component":null,"role":"qualification-evidence","size":47,"sha256":"sha256:ace7debc98b27c010573377567060bc323a7bdcb13be84ca198e44f4dfdc3504","permissions":"regular","linkTarget":null},{"path":"share/bloom/dependencies/unicode/15.1.0/CaseFolding.txt","type":"regular-file","component":null,"role":"qualification-evidence","size":68,"sha256":"sha256:a808ddb349f098b1df9e12b5fa34b49f11627a1c860390028445f534b2212b13","permissions":"regular","linkTarget":null},{"path":"share/bloom/dependencies/unicode/15.1.0/CompositionExclusions.txt","type":"regular-file","component":null,"role":"qualification-evidence","size":78,"sha256":"sha256:be50f8ba7ce727cf22a1cdd5e53b106c3a96c34212511182fe05981ba2d68263","permissions":"regular","linkTarget":null},{"path":"share/bloom/dependencies/unicode/15.1.0/DerivedNormalizationProps.txt","type":"regular-file","component":null,"role":"qualification-evidence","size":82,"sha256":"sha256:18689aeb9a46ce9f81561fd58d89b7c88bb6e15ec2cd126547793271f7249683","permissions":"regular","linkTarget":null},{"path":"share/bloom/dependencies/unicode/15.1.0/NormalizationTest.txt","type":"regular-file","component":null,"role":"qualification-evidence","size":74,"sha256":"sha256:0ac6226cca9afa0f6981e0435e8c5f0cd1dd9c1a5f67ccb7c094e4260c26d5f5","permissions":"regular","linkTarget":null},{"path":"share/bloom/dependencies/unicode/15.1.0/UnicodeData.txt","type":"regular-file","component":null,"role":"qualification-evidence","size":68,"sha256":"sha256:9d26bb74efc4972462e981ab4f476e7e4ebe931619743ba987767066593e1277","permissions":"regular","linkTarget":null}],"qualificationResults":[{"gateId":"bloom.gate.synthetic","status":"passed","evidence":[{"path":"share/bloom/dependencies/evidence/tests/fixtures/payloads/gate-evidence.txt","sha256":"sha256:ace7debc98b27c010573377567060bc323a7bdcb13be84ca198e44f4dfdc3504"}],"completedAt":"1970-01-01T00:00:00Z"}]}